{
  "id": "newcastle-sela-2026",
  "year": 2026,
  "clubId": "newcastle-united",
  "sponsorId": "sela",
  "what": "Dropped Sela",
  "text": "The Saudi state-owned events company is off the front of the shirt. A drinks brand replaces it.",
  "source": {
    "name": "The Mag",
    "date": "2026-06",
    "url": "https://www.themag.co.uk/2026/06/newcastle-united-have-agreed-new-main-sponsor-front-of-shirt-three-year-deal-to-replace-sela/"
  },
  "featured": true
}
