{
  "id": "schalke-gazprom-2022",
  "year": 2022,
  "clubId": "schalke-04",
  "sponsorId": "gazprom",
  "what": "Dropped Gazprom",
  "text": "Took the logo off the shirt within days, then ended a 15-year deal early.",
  "source": {
    "name": "RFE/RL",
    "date": "2022-03",
    "url": "https://www.rferl.org/a/gazprom-uefa-ferencvaros-hungary-soccer-ukraine-war-schalke/32941442.html",
    "note": "Schalke cut ties at the same time as UEFA, ending a 15-year front-of-shirt deal."
  },
  "featured": true
}
